{
  "generated_at": "2026-09-27T02:30:51Z",
  "input": {
    "format": "mmcif",
    "path": "tests/panel/5FQL.cif.gz",
    "sha256": "ac5ffc6fed697e7b2659f6747ad4d0638eb949220cd7ca7c8c3b372ce183f8d5"
  },
  "knowledge_base": {
    "sha256": "6d6499fb969960ee7d69ef0611b5498549251f08f622b48175259981c5d5b67b",
    "version": "0.8.0"
  },
  "manifest_sha256": "a7191ab3fd8223db18d1fd8318748776db3913ddee80065c0639cc102e6756c2",
  "method": {
    "ambiguity_window_ph": 1.0,
    "hydrogen_tool": "openmm_modeller",
    "pka_tool": "propka",
    "pka_tool_version": "3.5.1",
    "platform": "Reference",
    "seed": 20260927,
    "unreliable_within_angstrom": 6.0
  },
  "ph": 7.2,
  "ph_rationale": "ER lumen (folding question), TASK-009 decision 1",
  "propka_version": "3.5.1",
  "schema_version": "0.1.0",
  "simprep": {
    "git_commit": "fe91df01358926252a685100756515747fada81b-dirty",
    "version": "0.1.0"
  },
  "systems": [
    {
      "counts": [
        {
          "added": 10,
          "excluded": 0,
          "in": 507,
          "modified": 507,
          "out": 517,
          "passed_through": 0,
          "record_type": "polymer residues"
        },
        {
          "added": 0,
          "excluded": 2,
          "in": 6,
          "modified": 0,
          "out": 4,
          "passed_through": 4,
          "record_type": "nonpolymer residues"
        },
        {
          "added": 0,
          "excluded": 13,
          "in": 13,
          "modified": 0,
          "out": 0,
          "passed_through": 0,
          "record_type": "branched residues"
        },
        {
          "added": 0,
          "excluded": 0,
          "in": 213,
          "modified": 213,
          "out": 213,
          "passed_through": 0,
          "record_type": "water residues"
        },
        {
          "added": 625,
          "excluded": 431,
          "in": 8576,
          "modified": 8141,
          "out": 8770,
          "passed_through": 4,
          "record_type": "atom records"
        },
        {
          "added": 0,
          "excluded": 17,
          "in": 26,
          "modified": 3,
          "out": 9,
          "passed_through": 6,
          "record_type": "struct_conn records"
        },
        {
          "added": 1,
          "excluded": 1,
          "in": 8,
          "modified": 0,
          "out": 8,
          "passed_through": 7,
          "record_type": "pdbx_struct_mod_residue records"
        },
        {
          "added": 0,
          "excluded": 10,
          "in": 18,
          "modified": 0,
          "out": 8,
          "passed_through": 8,
          "record_type": "unobserved polymer residues (annotation)"
        }
      ],
      "differs_from_wild_type": [],
      "directory": "wt_protonated",
      "files": [
        {
          "format": "mmcif",
          "path": "system.cif",
          "sha256": "c735d95b644eeeee5b55facfa7c5348b7f9eab86a4b2400f4442eabe10bb8628"
        },
        {
          "format": "pdb",
          "path": "system.pdb",
          "sha256": "db2ef6827c477b38d7ee727abccea178a862019ed815b8fabc3e131e93042708"
        }
      ],
      "findings": [
        {
          "anchor_residues": [
            {
              "chain": "A",
              "ins_code": "",
              "seq_num": 135
            }
          ],
          "base_severity": "warn",
          "effective_severity": "warn",
          "evidence": [
            {
              "key": "pka",
              "type": "number",
              "unit": "pH",
              "value": 7.426
            },
            {
              "key": "model_pka",
              "type": "number",
              "unit": "pH",
              "value": 10.5
            },
            {
              "key": "ph",
              "type": "number",
              "unit": "pH",
              "value": 7.2
            },
            {
              "key": "near",
              "type": "label",
              "value": "DDZ A:84"
            },
            {
              "key": "distance_to_ignored_chemistry",
              "type": "number",
              "unit": "angstrom",
              "value": 3.478
            }
          ],
          "id": "protonation/wt/A:135",
          "locus": {
            "atom_names": [],
            "chain": "A",
            "extent": [
              {
                "chain": "A",
                "ins_code": "",
                "res_name": "LYS",
                "seq_num": 135
              }
            ],
            "ins_code": "",
            "res_name": "LYS",
            "seq_num": 135
          },
          "options": [
            {
              "cost_hint": "low",
              "id": "predicted_state",
              "label": "Use the state the pKa estimate gives at the study's pH",
              "prep_action": "apply",
              "prep_stage": "protonation",
              "trade_offs": [
                "Follows the structure-based estimate.",
                "The estimate's error (about one pH unit) is comparable to its distance from the pH."
              ]
            },
            {
              "cost_hint": "low",
              "id": "standard_state",
              "label": "Use the state of the residue's model pKa (the unperturbed value) at the study's pH",
              "prep_action": "apply",
              "prep_stage": "protonation",
              "trade_offs": [
                "Ignores the environment's shift, which may be real.",
                "Robust where the estimate cannot see part of the environment."
              ]
            },
            {
              "cost_hint": "low",
              "id": "specific_state",
              "label": "Use the state named in the decision (parameters.state, e.g. HID, ASH, LYN)",
              "prep_action": "apply",
              "prep_stage": "protonation",
              "trade_offs": [
                "Encodes outside knowledge (experiment, literature, a better calculation).",
                "Must name a variant the residue has."
              ]
            }
          ],
          "rationale": "PROPKA does not include metal ions or non-standard residues, so a titratable residue close to one gets an estimate from an incomplete environment (at 5FQL the lysines around the former sulfate come out 3-4 units low). Metal ligands annotated in struct_conn follow the metal rule instead and get no finding.",
          "recommendation_basis": "default",
          "recommended_option": "standard_state",
          "references": [],
          "rule_family": "protonation",
          "rule_id": "protonation.unreliable_estimate",
          "severity_context": {
            "min_distance_angstrom": null,
            "nearest_region": null,
            "proximity": "no_regions",
            "raise_levels": 0
          },
          "title": "pKa estimate near chemistry the method ignores: LYS A:135 (wt)",
          "verify_flags": []
        },
        {
          "anchor_residues": [
            {
              "chain": "A",
              "ins_code": "",
              "seq_num": 138
            }
          ],
          "base_severity": "warn",
          "effective_severity": "warn",
          "evidence": [
            {
              "key": "pka",
              "type": "number",
              "unit": "pH",
              "value": 1.114
            },
            {
              "key": "model_pka",
              "type": "number",
              "unit": "pH",
              "value": 6.5
            },
            {
              "key": "ph",
              "type": "number",
              "unit": "pH",
              "value": 7.2
            },
            {
              "key": "near",
              "type": "label",
              "value": "DDZ A:84"
            },
            {
              "key": "distance_to_ignored_chemistry",
              "type": "number",
              "unit": "angstrom",
              "value": 2.741
            }
          ],
          "id": "protonation/wt/A:138",
          "locus": {
            "atom_names": [],
            "chain": "A",
            "extent": [
              {
                "chain": "A",
                "ins_code": "",
                "res_name": "HIS",
                "seq_num": 138
              }
            ],
            "ins_code": "",
            "res_name": "HIS",
            "seq_num": 138
          },
          "options": [
            {
              "cost_hint": "low",
              "id": "predicted_state",
              "label": "Use the state the pKa estimate gives at the study's pH",
              "prep_action": "apply",
              "prep_stage": "protonation",
              "trade_offs": [
                "Follows the structure-based estimate.",
                "The estimate's error (about one pH unit) is comparable to its distance from the pH."
              ]
            },
            {
              "cost_hint": "low",
              "id": "standard_state",
              "label": "Use the state of the residue's model pKa (the unperturbed value) at the study's pH",
              "prep_action": "apply",
              "prep_stage": "protonation",
              "trade_offs": [
                "Ignores the environment's shift, which may be real.",
                "Robust where the estimate cannot see part of the environment."
              ]
            },
            {
              "cost_hint": "low",
              "id": "specific_state",
              "label": "Use the state named in the decision (parameters.state, e.g. HID, ASH, LYN)",
              "prep_action": "apply",
              "prep_stage": "protonation",
              "trade_offs": [
                "Encodes outside knowledge (experiment, literature, a better calculation).",
                "Must name a variant the residue has."
              ]
            }
          ],